{
  "version": "1.0",
  "generatedAt": "2026-05-24T19:53:12.357Z",
  "recoveryDecision": "needs_more_context",
  "plans": [],
  "proposedObjects": [],
  "unresolvedQuestions": [
    {
      "type": "missing_data",
      "message": "Pending agent repair. Replace this placeholder after evaluating the handoff inputs."
    }
  ],
  "rationale": [
    "Template response created by handoff writer. Replace this placeholder with the final agent rationale."
  ]
}